Enter password: ********
Welcome to the MySQL monitor.  Commands end with ; or \g.
Your MySQL connection id is 13
Server version: 8.0.34 MySQL Community Server - GPL

Copyright (c) 2000, 2023, Oracle and/or its affiliates.

Oracle is a registered trademark of Oracle Corporation and/or its
affiliates. Other names may be trademarks of their respective
owners.

Type 'help;' or '\h' for help. Type '\c' to clear the current input statement.

mysql> show databases;
+--------------------+
| Database           |
+--------------------+
| bank               |
| information_schema |
| mysql              |
| performance_schema |
| school             |
| sys                |
+--------------------+
6 rows in set (0.00 sec)

mysql> use bank;
Database changed
mysql> create table bank(sno int, Cust_Name varchar(20), Acc_No int(10), Balance int(10), Cus_Branch varchar(20));
ERROR 1050 (42S01): Table 'bank' already exists
mysql> desc bank:
    -> desc bank;
ERROR 1064 (42000): You have an error in your SQL syntax; check the manual that corresponds to your MySQL server version for the right syntax to use near ':
desc bank' at line 1
mysql> desc bank;
+-------------+-------------+------+-----+---------+-------+
| Field       | Type        | Null | Key | Default | Extra |
+-------------+-------------+------+-----+---------+-------+
| sno         | int         | YES  |     | NULL    |       |
| cust_name   | varchar(20) | YES  |     | NULL    |       |
| Balance     | int         | YES  |     | NULL    |       |
| cust_branch | varchar(20) | YES  |     | NULL    |       |
+-------------+-------------+------+-----+---------+-------+
4 rows in set (0.06 sec)

mysql> insert into bank values(1, 'Ramesh', 12378, 100000, 'Adayar');
ERROR 1136 (21S01): Column count doesn't match value count at row 1
mysql> alter table acc_no
    -> add acc_no int;
ERROR 1146 (42S02): Table 'bank.acc_no' doesn't exist
mysql> use school;
Database changed
mysql> create table bank(
    -> sno int,
    -> Cus_Name varchar(20),
    -> Acc_No int(10),
    -> Balance int(10),
    -> Cus_Branch varchar(20)
    -> );
Query OK, 0 rows affected, 2 warnings (0.06 sec)

mysql> desc bank;
+------------+-------------+------+-----+---------+-------+
| Field      | Type        | Null | Key | Default | Extra |
+------------+-------------+------+-----+---------+-------+
| sno        | int         | YES  |     | NULL    |       |
| Cus_Name   | varchar(20) | YES  |     | NULL    |       |
| Acc_No     | int         | YES  |     | NULL    |       |
| Balance    | int         | YES  |     | NULL    |       |
| Cus_Branch | varchar(20) | YES  |     | NULL    |       |
+------------+-------------+------+-----+---------+-------+
5 rows in set (0.01 sec)

mysql> insert into bank values(1, 'Ramesh', 12378, 100000, 'Adayar');
Query OK, 1 row affected (0.04 sec)

mysql> insert into bank values(2, 'Sam', 12367, 152500, 'Mylapore');
Query OK, 1 row affected (0.04 sec)

mysql> insert into bank values(3, 'Harish', 12345, 250000, 'Anna salai');
Query OK, 1 row affected (0.04 sec)

mysql> select*from bank;
+------+----------+--------+---------+------------+
| sno  | Cus_Name | Acc_No | Balance | Cus_Branch |
+------+----------+--------+---------+------------+
|    1 | Ramesh   |  12378 |  100000 | Adayar     |
|    2 | Sam      |  12367 |  152500 | Mylapore   |
|    3 | Harish   |  12345 |  250000 | Anna salai |
+------+----------+--------+---------+------------+
3 rows in set (0.00 sec)

mysql> select acc_no from bank where Cus_branch='adayar';
+--------+
| acc_no |
+--------+
|  12378 |
+--------+
1 row in set (0.04 sec)

mysql> select cust_name from bank where balance>150000;
ERROR 1054 (42S22): Unknown column 'cust_name' in 'field list'
mysql> select cus_name from bank where balance>150000;
+----------+
| cus_name |
+----------+
| Sam      |
| Harish   |
+----------+
2 rows in set (0.00 sec)

mysql> select*from bank where balance between 100000 and 200000;
+------+----------+--------+---------+------------+
| sno  | Cus_Name | Acc_No | Balance | Cus_Branch |
+------+----------+--------+---------+------------+
|    1 | Ramesh   |  12378 |  100000 | Adayar     |
|    2 | Sam      |  12367 |  152500 | Mylapore   |
+------+----------+--------+---------+------------+
2 rows in set (0.04 sec)
mysql> update bank set cus_branch = 'poonamallee' where sno = 2;
Query OK, 1 row affected (0.04 sec)
Rows matched: 1  Changed: 1  Warnings: 0

mysql> select*from bank;
+------+----------+--------+---------+-------------+
| sno  | Cus_Name | Acc_No | Balance | Cus_Branch  |
+------+----------+--------+---------+-------------+
|    1 | Ramesh   |  12378 |  100000 | Adayar      |
|    2 | Sam      |  12367 |  152500 | poonamallee |
|    3 | Harish   |  12345 |  250000 | Anna salai  |
+------+----------+--------+---------+-------------+
3 rows in set (0.00 sec)
